{
  "schema": "dailyfuel/map-fleet-points/1",
  "source": "Weigh station and truck service points compiled by DailyFuel",
  "licence": "CC BY 4.0",
  "licence_url": "https://creativecommons.org/licenses/by/4.0/",
  "attribution": "Weigh station and truck service points: DailyFuel",
  "imported": "2026-09-23",
  "dedupe_m": 25,
  "counts": {
    "weigh": 500,
    "inspection": 12,
    "port_of_entry": 24,
    "ta": 163,
    "petro": 12,
    "loves_shop": 195,
    "speedco": 107,
    "lubezone": 8,
    "profleet": 3
  },
  "points": [
    {
      "lat": 24.95481,
      "lon": -80.58106,
      "category": "weigh",
      "direction": null,
      "state": "FL",
      "label": "Weigh station"
    },
    {
      "lat": 26.75394,
      "lon": -81.03769,
      "category": "weigh",
      "direction": null,
      "state": "FL",
      "label": "Weigh station"
    },
    {
      "lat": 27.93756,
      "lon": -82.11381,
      "category": "weigh",
      "direction": null,
      "state": "FL",
      "label": "Weigh station"
    },
    {
      "lat": 28.28182,
      "lon": -97.29544,
      "category": "weigh",
      "direction": null,
      "state": "TX",
      "label": "Weigh station"
    },
    {
      "lat": 28.32188,
      "lon": -97.70379,
      "category": "weigh",
      "direction": null,
      "state": "TX",
      "label": "Weigh station"
    },
    {
      "lat": 28.46366,
      "lon": -97.68233,
      "category": "weigh",
      "direction": null,
      "state": "TX",
      "label": "Weigh station"
    },
    {
      "lat": 28.54662,
      "lon": -98.19174,
      "category": "weigh",
      "direction": null,
      "state": "TX",
      "label": "Weigh station"
    },
    {
      "lat": 28.55782,
      "lon": -98.19554,
      "category": "weigh",
      "direction": null,
      "state": "TX",
      "label": "Weigh station"
    },
    {
      "lat": 28.69127,
      "lon": -97.25703,
      "category": "weigh",
      "direction": null,
      "state": "TX",
      "label": "Weigh station"
    },
    {
      "lat": 28.69203,
      "lon": -97.25723,
      "category": "weigh",
      "direction": null,
      "state": "TX",
      "label": "Weigh station"
    },
    {
      "lat": 28.92758,
      "lon": -96.74807,
      "category": "weigh",
      "direction": null,
      "state": "TX",
      "label": "Weigh station"
    },
    {
      "lat": 29.09194,
      "lon": -98.95344,
      "category": "weigh",
      "direction": null,
      "state": "TX",
      "label": "Weigh station"
    },
    {
      "lat": 29.09269,
      "lon": -98.95335,
      "category": "weigh",
      "direction": null,
      "state": "TX",
      "label": "Weigh station"
    },
    {
      "lat": 29.40814,
      "lon": -96.06307,
      "category": "weigh",
      "direction": null,
      "state": "TX",
      "label": "Weigh station"
    },
    {
      "lat": 29.62529,
      "lon": -97.76771,
      "category": "weigh",
      "direction": null,
      "state": "TX",
      "label": "Weigh station"
    },
    {
      "lat": 29.6262,
      "lon": -97.76856,
      "category": "weigh",
      "direction": null,
      "state": "TX",
      "label": "Weigh station"
    },
    {
      "lat": 29.77356,
      "lon": -96.07344,
      "category": "weigh",
      "direction": null,
      "state": "TX",
      "label": "Weigh station"
    },
    {
      "lat": 29.77642,
      "lon": -96.01184,
      "category": "weigh",
      "direction": null,
      "state": "TX",
      "label": "Weigh station"
    },
    {
      "lat": 29.92369,
      "lon": -97.89269,
      "category": "weigh",
      "direction": null,
      "state": "TX",
      "label": "Weigh station"
    },
    {
      "lat": 30.10019,
      "lon": -90.48231,
      "category": "weigh",
      "direction": null,
      "state": "LA",
      "label": "Weigh station"
    },
    {
      "lat": 30.10046,
      "lon": -90.4808,
      "category": "weigh",
      "direction": null,
      "state": "LA",
      "label": "Weigh station"
    },
    {
      "lat": 30.34281,
      "lon": -89.47469,
      "category": "weigh",
      "direction": null,
      "state": "MS",
      "label": "Weigh station"
    },
    {
      "lat": 30.38206,
      "lon": -82.87056,
      "category": "weigh",
      "direction": null,
      "state": "FL",
      "label": "Weigh station"
    },
    {
      "lat": 30.38281,
      "lon": -82.86969,
      "category": "weigh",
      "direction": null,
      "state": "FL",
      "label": "Weigh station"
    },
    {
      "lat": 30.47894,
      "lon": -90.52119,
      "category": "weigh",
      "direction": null,
      "state": "LA",
      "label": "Weigh station"
    },
    {
      "lat": 30.47983,
      "lon": -90.52156,
      "category": "weigh",
      "direction": null,
      "state": "LA",
      "label": "Weigh station"
    },
    {
      "lat": 30.52444,
      "lon": -95.49156,
      "category": "weigh",
      "direction": null,
      "state": "TX",
      "label": "Weigh station"
    },
    {
      "lat": 30.69944,
      "lon": -81.66219,
      "category": "weigh",
      "direction": null,
      "state": "FL",
      "label": "Weigh station"
    },
    {
      "lat": 30.74344,
      "lon": -81.95431,
      "category": "weigh",
      "direction": null,
      "state": "FL",
      "label": "Weigh station"
    },
    {
      "lat": 30.89331,
      "lon": -90.52869,
      "category": "weigh",
      "direction": null,
      "state": "LA",
      "label": "Weigh station"
    },
    {
      "lat": 31.01219,
      "lon": -89.79644,
      "category": "weigh",
      "direction": null,
      "state": "MS",
      "label": "Weigh station"
    },
    {
      "lat": 31.07639,
      "lon": -91.07217,
      "category": "weigh",
      "direction": null,
      "state": "MS",
      "label": "Weigh station"
    },
    {
      "lat": 31.19122,
      "lon": -105.42997,
      "category": "weigh",
      "direction": null,
      "state": "TX",
      "label": "Weigh station"
    },
    {
      "lat": 32.25781,
      "lon": -109.17944,
      "category": "weigh",
      "direction": null,
      "state": "AZ",
      "label": "Weigh station"
    },
    {
      "lat": 32.32031,
      "lon": -90.94781,
      "category": "weigh",
      "direction": null,
      "state": "LA",
      "label": "Weigh station"
    },
    {
      "lat": 32.35444,
      "lon": -90.75394,
      "category": "weigh",
      "direction": null,
      "state": "MS",
      "label": "Weigh station"
    },
    {
      "lat": 32.43694,
      "lon": -88.43531,
      "category": "weigh",
      "direction": null,
      "state": "MS",
      "label": "Weigh station"
    },
    {
      "lat": 32.43856,
      "lon": -88.43656,
      "category": "weigh",
      "direction": null,
      "state": "MS",
      "label": "Weigh station"
    },
    {
      "lat": 32.48656,
      "lon": -89.54381,
      "category": "weigh",
      "direction": null,
      "state": "MS",
      "label": "Weigh station"
    },
    {
      "lat": 32.49276,
      "lon": -95.5582,
      "category": "weigh",
      "direction": null,
      "state": "TX",
      "label": "Weigh station"
    },
    {
      "lat": 32.49283,
      "lon": -95.56012,
      "category": "weigh",
      "direction": null,
      "state": "TX",
      "label": "Weigh station"
    },
    {
      "lat": 32.65862,
      "lon": -96.10858,
      "category": "weigh",
      "direction": null,
      "state": "TX",
      "label": "Weigh station"
    },
    {
      "lat": 32.65874,
      "lon": -96.10583,
      "category": "weigh",
      "direction": null,
      "state": "TX",
      "label": "Weigh station"
    },
    {
      "lat": 32.71344,
      "lon": -114.61206,
      "category": "weigh",
      "direction": null,
      "state": "AZ",
      "label": "Weigh station"
    },
    {
      "lat": 33.06906,
      "lon": -83.97356,
      "category": "weigh",
      "direction": null,
      "state": "GA",
      "label": "Weigh station"
    },
    {
      "lat": 33.07027,
      "lon": -83.97322,
      "category": "weigh",
      "direction": null,
      "state": "GA",
      "label": "Weigh station"
    },
    {
      "lat": 33.15832,
      "lon": -95.05008,
      "category": "weigh",
      "direction": null,
      "state": "TX",
      "label": "Weigh station"
    },
    {
      "lat": 33.35144,
      "lon": -117.52481,
      "category": "weigh",
      "direction": null,
      "state": "CA",
      "label": "Weigh station"
    },
    {
      "lat": 33.35219,
      "lon": -117.52406,
      "category": "weigh",
      "direction": null,
      "state": "CA",
      "label": "Weigh station"
    },
    {
      "lat": 33.44706,
      "lon": -117.13494,
      "category": "weigh",
      "direction": null,
      "state": "CA",
      "label": "Weigh station"
    },
    {
      "lat": 33.60969,
      "lon": -114.74131,
      "category": "weigh",
      "direction": null,
      "state": "CA",
      "label": "Weigh station"
    },
    {
      "lat": 33.61269,
      "lon": -114.47056,
      "category": "weigh",
      "direction": null,
      "state": "AZ",
      "label": "Weigh station"
    },
    {
      "lat": 33.61419,
      "lon": -114.47069,
      "category": "weigh",
      "direction": null,
      "state": "AZ",
      "label": "Weigh station"
    },
    {
      "lat": 33.64481,
      "lon": -85.43919,
      "category": "weigh",
      "direction": null,
      "state": "AL",
      "label": "Weigh station"
    },
    {
      "lat": 33.69636,
      "lon": -85.08569,
      "category": "weigh",
      "direction": null,
      "state": "GA",
      "label": "Weigh station"
    },
    {
      "lat": 33.77271,
      "lon": -84.63029,
      "category": "weigh",
      "direction": null,
      "state": "GA",
      "label": "Weigh station"
    },
    {
      "lat": 33.77931,
      "lon": -81.48944,
      "category": "weigh",
      "direction": null,
      "state": "SC",
      "label": "Weigh station"
    },
    {
      "lat": 33.80506,
      "lon": -96.53619,
      "category": "weigh",
      "direction": null,